{
  "format": "novolis.cad.layers",
  "schemaVersion": 1,
  "name": "NCS house floor-plan starter",
  "standard": "NCS",
  "standardVersion": "6",
  "generator": { "name": "Novolis.Governance", "version": "2026.1.0" },
  "createdAt": "2026-07-29T08:00:00Z",
  "modifiedAt": "2026-07-29T08:00:00Z",
  "layers": [
    {
      "id": "b1000000-0000-4000-8000-000000000001",
      "name": "A-WALL-FULL",
      "discipline": "A",
      "major": "WALL",
      "minor": ["FULL"],
      "description": "Full-height walls",
      "defaultColor": [0.2, 0.2, 0.2],
      "defaultLineWeightMm": 0.5,
      "defaultLinetype": "Continuous",
      "plot": true
    },
    {
      "id": "b1000000-0000-4000-8000-000000000002",
      "name": "A-WALL-PATT",
      "discipline": "A",
      "major": "WALL",
      "minor": ["PATT"],
      "description": "Wall hatch / cut fill patterns",
      "defaultColor": [0.45, 0.45, 0.45],
      "defaultLineWeightMm": 0.18,
      "defaultLinetype": "Continuous",
      "plot": true
    },
    {
      "id": "b1000000-0000-4000-8000-000000000003",
      "name": "A-DOOR",
      "discipline": "A",
      "major": "DOOR",
      "description": "Doors and door swings",
      "defaultColor": [0.55, 0.35, 0.15],
      "defaultLineWeightMm": 0.25,
      "defaultLinetype": "Continuous",
      "plot": true
    },
    {
      "id": "b1000000-0000-4000-8000-000000000004",
      "name": "A-GLAZ",
      "discipline": "A",
      "major": "GLAZ",
      "description": "Windows and glazing",
      "defaultColor": [0.25, 0.45, 0.75],
      "defaultLineWeightMm": 0.25,
      "defaultLinetype": "Continuous",
      "plot": true
    },
    {
      "id": "b1000000-0000-4000-8000-000000000005",
      "name": "A-AREA",
      "discipline": "A",
      "major": "AREA",
      "description": "Room / space boundaries",
      "defaultColor": [0.7, 0.7, 0.85],
      "defaultLineWeightMm": 0.13,
      "defaultLinetype": "Continuous",
      "plot": true
    },
    {
      "id": "b1000000-0000-4000-8000-000000000006",
      "name": "A-ANNO-TEXT",
      "discipline": "A",
      "major": "ANNO",
      "minor": ["TEXT"],
      "description": "Room names and general text",
      "defaultColor": [0.1, 0.1, 0.1],
      "defaultLineWeightMm": 0.18,
      "defaultLinetype": "Continuous",
      "plot": true
    },
    {
      "id": "b1000000-0000-4000-8000-000000000007",
      "name": "A-ANNO-DIMS",
      "discipline": "A",
      "major": "ANNO",
      "minor": ["DIMS"],
      "description": "Dimensions",
      "defaultColor": [0.1, 0.1, 0.1],
      "defaultLineWeightMm": 0.18,
      "defaultLinetype": "Continuous",
      "plot": true
    },
    {
      "id": "b1000000-0000-4000-8000-000000000008",
      "name": "S-COLS",
      "discipline": "S",
      "major": "COLS",
      "description": "Structural columns",
      "defaultColor": [0.75, 0.15, 0.15],
      "defaultLineWeightMm": 0.35,
      "defaultLinetype": "Continuous",
      "plot": true
    },
    {
      "id": "b1000000-0000-4000-8000-000000000009",
      "name": "S-BEAM",
      "discipline": "S",
      "major": "BEAM",
      "description": "Beams and framing members",
      "defaultColor": [0.75, 0.2, 0.2],
      "defaultLineWeightMm": 0.25,
      "defaultLinetype": "Dashed",
      "plot": true
    },
    {
      "id": "b1000000-0000-4000-8000-00000000000a",
      "name": "S-GRID",
      "discipline": "S",
      "major": "GRID",
      "description": "Structural grid / axes",
      "defaultColor": [0.85, 0.45, 0.1],
      "defaultLineWeightMm": 0.18,
      "defaultLinetype": "Center",
      "plot": true
    },
    {
      "id": "b1000000-0000-4000-8000-00000000000b",
      "name": "A-FLOR",
      "discipline": "A",
      "major": "FLOR",
      "description": "Floor outlines",
      "defaultColor": [0.5, 0.5, 0.5],
      "defaultLineWeightMm": 0.25,
      "defaultLinetype": "Continuous",
      "plot": true
    },
    {
      "id": "b1000000-0000-4000-8000-00000000000c",
      "name": "G-ANNO-TTLB",
      "discipline": "G",
      "major": "ANNO",
      "minor": ["TTLB"],
      "description": "Title block (sheet / paper space)",
      "defaultColor": [0.05, 0.05, 0.05],
      "defaultLineWeightMm": 0.35,
      "defaultLinetype": "Continuous",
      "plot": true
    }
  ],
  "properties": {
    "note": "Starter subset for a simple house floor plan — not the full NCS layer list"
  }
}
