{
  "format": "novolis.cad.layers",
  "schemaVersion": 1,
  "name": "Calypso ship layers",
  "standard": "custom",
  "standardVersion": "1",
  "generator": { "name": "Novolis.Governance", "version": "2026.1.0" },
  "createdAt": "2026-07-29T08:00:00Z",
  "modifiedAt": "2026-07-29T08:00:00Z",
  "layers": [
    {
      "id": "d1000000-0000-4000-8000-000000000001",
      "name": "S-HULL",
      "discipline": "S",
      "major": "HULL",
      "description": "Outer / inner hull shell",
      "defaultColor": [0.35, 0.65, 1.0],
      "defaultLineWeightMm": 0.5,
      "defaultLinetype": "Continuous",
      "plot": true
    },
    {
      "id": "d1000000-0000-4000-8000-000000000002",
      "name": "A-WALL",
      "discipline": "A",
      "major": "WALL",
      "description": "Interior partitions and bulkheads",
      "defaultColor": [0.45, 0.55, 0.7],
      "defaultLineWeightMm": 0.35,
      "defaultLinetype": "Continuous",
      "plot": true
    },
    {
      "id": "d1000000-0000-4000-8000-000000000003",
      "name": "A-DOOR",
      "discipline": "A",
      "major": "DOOR",
      "description": "Doors and airtight hatches",
      "defaultColor": [0.7, 0.55, 0.3],
      "defaultLineWeightMm": 0.25,
      "defaultLinetype": "Continuous",
      "plot": true
    },
    {
      "id": "d1000000-0000-4000-8000-000000000004",
      "name": "A-CORR",
      "discipline": "A",
      "major": "CORR",
      "description": "Corridors and circulation",
      "defaultColor": [0.49, 0.91, 0.53],
      "defaultLineWeightMm": 0.18,
      "defaultLinetype": "Continuous",
      "plot": true
    },
    {
      "id": "d1000000-0000-4000-8000-000000000005",
      "name": "A-ZONE-CARGO",
      "discipline": "A",
      "major": "ZONE",
      "minor": ["CARG"],
      "description": "Cargo hold / void",
      "defaultColor": [0.25, 0.72, 0.31],
      "defaultLineWeightMm": 0.18,
      "plot": true
    },
    {
      "id": "d1000000-0000-4000-8000-000000000006",
      "name": "A-ZONE-HAB",
      "discipline": "A",
      "major": "ZONE",
      "minor": ["HAB"],
      "description": "Habitability (cabins, galley, berths)",
      "defaultColor": [0.35, 0.65, 1.0],
      "defaultLineWeightMm": 0.18,
      "plot": true
    },
    {
      "id": "d1000000-0000-4000-8000-000000000007",
      "name": "A-ZONE-ENG",
      "discipline": "A",
      "major": "ZONE",
      "minor": ["ENG"],
      "description": "Engineering",
      "defaultColor": [0.97, 0.32, 0.29],
      "defaultLineWeightMm": 0.18,
      "plot": true
    },
    {
      "id": "d1000000-0000-4000-8000-000000000008",
      "name": "A-ZONE-UTIL",
      "discipline": "A",
      "major": "ZONE",
      "minor": ["UTIL"],
      "description": "Utilities / life support",
      "defaultColor": [0.64, 0.44, 0.97],
      "defaultLineWeightMm": 0.18,
      "plot": true
    },
    {
      "id": "d1000000-0000-4000-8000-000000000009",
      "name": "A-ZONE-BRIDGE",
      "discipline": "A",
      "major": "ZONE",
      "minor": ["BRDG"],
      "description": "Bridge / command",
      "defaultColor": [0.82, 0.6, 0.13],
      "defaultLineWeightMm": 0.18,
      "plot": true
    },
    {
      "id": "d1000000-0000-4000-8000-00000000000a",
      "name": "A-ANNO",
      "discipline": "A",
      "major": "ANNO",
      "description": "Labels and notes",
      "defaultColor": [0.79, 0.82, 0.85],
      "defaultLineWeightMm": 0.13,
      "plot": true
    }
  ],
  "properties": {
    "note": "Custom ship layer set for Calypso Rev G dogfood — not NCS"
  }
}
